{
  "id": 10002687,
  "name": "Example Professional",
  "description": "Example description.",
  "tagline": "example_value",
  "localizedName": "Acme Corporation",
  "localizedDescription": "Leading provider of innovative solutions",
  "localizedTagline": "Innovation at its best",
  "vanityName": "acme-corp",
  "organizationType": "PRIVATELY_HELD",
  "staffCountRange": "SIZE_201_TO_500"
}